{
  "spec": "kotoshu.resources/v1",
  "registry_version": 1,
  "generated_at": "2026-09-03T17:10:16Z",
  "release_tag": null,
  "resources": {
    "kotoshu://models/de/full": {
      "type": "model",
      "language": "de",
      "tier": {
        "name": "full",
        "dims": 300,
        "vocab_size": 3,
        "quantization": null
      },
      "version": "0.0.0-dev",
      "urls": {
        "primary": null,
        "mirror": null
      },
      "vocab_url": null,
      "sha256": "18ac3e7343f016890c510e93f935261169d9e3f565436429830faf0934f4f8e4",
      "size_bytes": 1,
      "license": "CC-BY-SA-3.0",
      "min_engine_version": "0.7",
      "eval_ref": null
    },
    "kotoshu://models/en/fluency": {
      "type": "model",
      "language": "en",
      "tier": {
        "name": "fluency",
        "dims": 128,
        "vocab_size": 1,
        "quantization": "int8-per-row"
      },
      "version": "0.0.0-dev",
      "urls": {
        "primary": null,
        "mirror": null
      },
      "vocab_url": null,
      "sha256": "252f10c83610ebca1a059c0bae8255eba2f95be4d1d7bcfa89d7248a82d9f111",
      "size_bytes": 1,
      "license": "CC-BY-SA-3.0",
      "min_engine_version": "0.7",
      "eval_ref": "eval/reports/en.fluency.json"
    },
    "kotoshu://models/en/full": {
      "type": "model",
      "language": "en",
      "tier": {
        "name": "full",
        "dims": 300,
        "vocab_size": 2,
        "quantization": null
      },
      "version": "0.0.0-dev",
      "urls": {
        "primary": null,
        "mirror": null
      },
      "vocab_url": null,
      "sha256": "3f79bb7b435b05321651daefd374cdc681dc06faa65e374e38337b88ca046dea",
      "size_bytes": 1,
      "license": "CC-BY-SA-3.0",
      "min_engine_version": "0.7",
      "eval_ref": null
    },
    "kotoshu://models/typo/typo-biencoder": {
      "type": "model",
      "language": "typo",
      "tier": {
        "name": "typo-biencoder",
        "dims": 256,
        "vocab_size": 2,
        "quantization": "int8-dynamic"
      },
      "version": "0.0.0-dev",
      "urls": {
        "primary": null,
        "mirror": "https://raw.githubusercontent.com/kotoshu/models-fasttext-onnx/main/models/typo/typo.biencoder.onnx"
      },
      "vocab_url": null,
      "sha256": "e632b7095b0bf32c260fa4c539e9fd7b852d0de454e9be26f24d0d6f91d069d3",
      "size_bytes": 1,
      "license": "CC-BY-SA-3.0",
      "min_engine_version": "0.7",
      "eval_ref": "eval/reports/hybrid-pricing.json"
    },
    "kotoshu://packs/en": {
      "type": "pack",
      "language": "en",
      "version": "0.0.0-dev",
      "tier": "fluency",
      "dictionary_pin": "0123456789abcdef0123456789abcdef01234567",
      "contents": {
        "aff": {
          "tag": 1,
          "offset": 13,
          "length": 10,
          "sha256": "7f6d7c55043d4b09d0a4380720847457b7954048bf1dac70512593006bae8c37"
        },
        "dic": {
          "tag": 2,
          "offset": 60,
          "length": 14,
          "sha256": "02ae2811fa0b3674213fe6fe4121f4f77a41a56142c503c17667113b2d292fe1"
        },
        "model": {
          "tag": 3,
          "offset": 111,
          "length": 1,
          "sha256": "252f10c83610ebca1a059c0bae8255eba2f95be4d1d7bcfa89d7248a82d9f111"
        },
        "vocab": {
          "tag": 4,
          "offset": 149,
          "length": 43,
          "sha256": "e8031828ccf12164b09ffd1ecfddab271e75f6c7659e1aff1e46df5dec7609f0"
        }
      },
      "sha256": "9e066b659becb8cc9ea3f2ac08b28bf60ba787eaf372c5edbffe820728e10e7b",
      "size_bytes": 224,
      "licenses": {
        "embeddings": "CC-BY-SA-3.0",
        "dictionary": "https://cdn.jsdelivr.net/gh/kotoshu/dictionaries@0123456789abcdef0123456789abcdef01234567/en/spelling/license"
      },
      "min_engine_version": "0.5",
      "urls": {
        "primary": null,
        "mirror": "https://raw.githubusercontent.com/kotoshu/models-fasttext-onnx/main/packs/en-0.0.0-dev.bin"
      },
      "eval_ref": null
    }
  }
}